{
  "schema": "book2skill/capability-card@1",
  "capability_id": "cap.kan-tou-yin-hang.funding-liquidity-analysis",
  "revision": 2,
  "status": "draft",
  "slug": "funding-liquidity-analysis",
  "title": "负债质量与流动性分析",
  "one_liner": "同时检查资金成本、来源稳定性、期限与重定价错配，判断低成本负债优势是否以脆弱流动性为代价。",
  "source_manifest": "../source-manifest.json",
  "lineage": {
    "candidate_ids": [
      "ktbank-txt-2021.fw.ch01.l103-funding-cost",
      "ktbank-txt-2021.fw.ch01.l112-liquidity-coverage",
      "ktbank-txt-2021.pr.ch01.l131-deposit-quantity-quality",
      "ktbank-txt-2021.ce.ch01.l187-wholesale-mismatch",
      "ktbank-txt-2021.fw.ch06.l849-liquidity-risk",
      "ktbank-txt-2021.fw.ch09.l1241-liability-read"
    ],
    "aliases": [
      "legacy.liability-cost-evaluation"
    ],
    "supersedes": []
  },
  "selection": {
    "atomic_user_problem": "比较一家或多家银行的负债护城河，并识别短期同业融资、存单续作和久期错配带来的脆弱性。",
    "distinctive_value": "不把‘存款多’或‘成本低’当作充分结论，而是把成本、结构、稳定性、期限、重定价和流动性储备放在同一张表中。",
    "retention_review": {
      "source_faithfulness": {
        "passed": true,
        "evidence_ids": [
          "ev-ktb-ch01-l103-cost",
          "ev-ktb-ch01-l112-lcr",
          "ev-ktb-ch01-l131-deposit",
          "ev-ktb-ch01-l187-wholesale",
          "ev-ktb-ch06-l853-northern-rock",
          "ev-ktb-ch09-l1244-liability"
        ],
        "rationale": "证据覆盖负债成本、存款质量、流动性公式、同业负债风险、期限错配案例与报表读取位置；压力测试和标准化模板属于本轮推断。"
      },
      "executability": {
        "passed": true,
        "rationale": "可从定期报告及附注提取平均余额、利息支出、存款结构、批发融资、期限和流动性指标，形成成本桥与压力信号。"
      },
      "incremental_utility": {
        "status": "hypothesis",
        "comparison": "预计比只看存款占比或期末余额更能识别资金价格上升、主动批发融资和滚续风险；尚未独立评测。"
      },
      "falsifiable_boundedness": {
        "passed": true,
        "rationale": "无法取得期限、平均余额或当前监管定义时，只能做方向性分析；不能凭书中旧阈值判定合规。"
      },
      "repetition_or_novelty": {
        "role": "supporting_signal",
        "observed": true,
        "rationale": "负债成本、活期存款、同业资金和期限错配在第1、4、6、7、9、10章多次以独立机制出现。"
      }
    }
  },
  "routing": {
    "intents": [
      "比较银行存款与批发融资质量",
      "判断银行是否依赖短期资金支持长期资产",
      "解释负债成本或流动性风险为何变化"
    ],
    "trigger_signals": [
      "用户提到存款成本、活期占比、同业负债、同业存单、流动性覆盖或期限错配",
      "净息差变化疑似来自负债端",
      "银行增长很快但存款跟不上，需判断资金来源是否脆弱"
    ],
    "do_not_trigger": [
      "只问资产端贷款定价且不涉及资金来源时优先净息差或信用风险能力",
      "需要判定是否满足现行监管比例时必须先取得当前权威规则",
      "仅需解释某个货币政策工具定义时不必运行完整流程"
    ],
    "neighbor_distinctions": [
      {
        "capability_id": "cap.kan-tou-yin-hang.net-interest-margin-analysis",
        "use_this_when": "核心问题是资金来源的成本、稳定性、期限或续作能力。",
        "use_neighbor_when": "核心问题是资产收益与负债成本共同如何形成净利息收入。"
      },
      {
        "capability_id": "cap.kan-tou-yin-hang.credit-risk-lifecycle",
        "use_this_when": "担心的是负债挤兑、再融资或期限错配。",
        "use_neighbor_when": "担心的是借款人违约、贷款分类、拨备或核销。"
      }
    ]
  },
  "ria": {
    "reading": [
      {
        "evidence_id": "ev-ktb-ch01-l103-cost",
        "source_id": "src-ktbank-txt-2021",
        "locator": "第1章 > 1.1负债概述 > TXT lines 103-107；EPUB text/part0006.html#cha1_1_1_1",
        "claim_type": "explicit",
        "excerpt": "负债成本包含两部分：一个是直接成本，一个是间接成本。",
        "paraphrase": "负债评价既看计息负债的利率，也看获取和维护负债所需的网点、人员与设备投入。",
        "note": "书中把一半营运费用分给负债业务只是历史示例假设，运行时不得默认使用。"
      },
      {
        "evidence_id": "ev-ktb-ch01-l112-lcr",
        "source_id": "src-ktbank-txt-2021",
        "locator": "第1章 > 1.1负债概述 > 流动性覆盖率 > TXT lines 112-115；EPUB text/part0006.html#cha1_1_1_1",
        "claim_type": "explicit",
        "excerpt": "流动性覆盖率=合格优质流动性资产／未来30天现金净流出量。",
        "paraphrase": "流动性覆盖率从高质量流动资产与短期净现金流出两端刻画压力；具体折算与达标线取决于当期监管口径。",
        "note": "公式来自原书；2018年阈值只作历史背景，待外部核验。"
      },
      {
        "evidence_id": "ev-ktb-ch01-l131-deposit",
        "source_id": "src-ktbank-txt-2021",
        "locator": "第1章 > 1.2.2如何评估银行吸收存款的能力 > 评估标准：数量和质量 > TXT lines 128-142；EPUB text/part0006.html#cha1_1_1_2_2_1",
        "claim_type": "explicit",
        "excerpt": "主要考察两个方面：数量和质量。",
        "paraphrase": "存款能力需同时比较长期增长和成本，活期占比可帮助解释成本差异，但还要理解客户与业务来源。",
        "note": "避免把单期高增速等同于优质负债。"
      },
      {
        "evidence_id": "ev-ktb-ch01-l187-wholesale",
        "source_id": "src-ktbank-txt-2021",
        "locator": "第1章 > 1.3同业负债、1.4同业存单 > TXT lines 171-204；EPUB text/part0006.html#cha1_1_1_3",
        "claim_type": "synthesized",
        "excerpt": null,
        "paraphrase": "同业与存单可以快速补充资金，但通常更受市场流动性影响；短期批发负债匹配长期资产会放大续作与利率倒挂风险。",
        "note": "综合同业负债构成、主动/被动差异和同业存单期限特征。"
      },
      {
        "evidence_id": "ev-ktb-ch06-l853-northern-rock",
        "source_id": "src-ktbank-txt-2021",
        "locator": "第6章 > 6.2.8流动性风险 > 北岩银行案例 > TXT lines 849-858；EPUB text/part0011.html#cha6_6_1_2_13_41",
        "claim_type": "explicit",
        "excerpt": "流动性风险属于那种不发生则已、一发生就“要命”的风险",
        "paraphrase": "长期按揭资产与短期同业负债的严重错配，在市场流动性收紧时可由成本问题迅速演化为无法续作与挤兑。",
        "note": "案例说明机制，不证明所有批发融资银行都会失败。"
      },
      {
        "evidence_id": "ev-ktb-ch09-l1244-liability",
        "source_id": "src-ktbank-txt-2021",
        "locator": "第9章 > 9.1资产负债表 > 负债端 > TXT lines 1241-1250；EPUB text/part0014.html#cha9_9_1_1_1_2",
        "claim_type": "explicit",
        "excerpt": "负债的分布主要看同业负债占比的高低。",
        "paraphrase": "财报实操应读取负债增速、存款结构及利率、同业/存单占比和成本，并区分主动批发融资与结算沉淀。",
        "note": "同业占比监管阈值易变，不能直接沿用原书。"
      }
    ],
    "interpretation": {
      "model": "负债优势有三层：价格低、来源稳定、期限与资产相容。低成本若来自可随时流失或需频繁续作的批发资金，在压力期可能同时损害净息差和偿付流动性。",
      "decision_rules": [
        "用期间平均计息负债计算成本率；期末余额只能说明时点结构，二者不得混用。",
        "至少拆分存款、同业及其他金融机构资金、同业存单/其他债券、央行资金和非计息负债。",
        "存款优势同时观察规模增速、活期/定期、零售/对公、平均成本和异常跳变。",
        "批发融资同时观察占比、利率、期限、集中度、续作需求及对应资产久期。",
        "读取../current-standards.md并按银行资产规模选择LCR/NSFR或优质流动性资产充足率，同时检查流动性比例和流动性匹配率；规则as-of必须展示。",
        "负债间接成本只有在分部披露或可审计分摊依据充分时才计算，不默认把营运费用的50%归于负债。"
      ],
      "assumptions": [
        "银行披露了计息负债平均余额或足以近似平均余额的期初期末数据。",
        "存在可用的期限、重定价或流动性附注；缺失时压力判断只能定性。"
      ]
    },
    "application": {
      "past_cases": [
        {
          "case_id": "case-ktb-northern-rock",
          "problem": "长期住房贷款主要由短期同业资金支持。",
          "method_use": "把资产久期、流动性资产占比、存款占比和同业债务占比放在一起审查。",
          "result": "次贷危机后同业流动性收紧，银行无法以合理成本续作并发生挤兑；这是书中报告的历史案例。",
          "evidence_ids": [
            "ev-ktb-ch06-l853-northern-rock"
          ]
        }
      ],
      "future_scenarios": [
        {
          "scenario": "某银行资产扩张快于存款，净息差同时承压。",
          "recognition_signal": "同业存单、拆入资金或其他批发负债占比上升，负债成本出现跳升。",
          "expected_use": "建立资金来源桥，判断是结构性存款弱势、市场利率冲击还是期限错配，并列出续作压力。"
        }
      ]
    },
    "execution": {
      "required_inputs": [
        "至少两期负债科目期末余额和构成",
        "计息负债平均余额、利息支出及分项成本率",
        "存款按客户与期限的结构、活期占比和成本",
        "同业负债、同业存单/应付债券、央行资金的余额、成本与期限",
        "流动性资产、合同到期或重定价缺口及报告披露的流动性指标",
        "报告期、币种、单位、合并范围和当前适用规则的as-of"
      ],
      "steps": [
        {
          "step_id": "step-01",
          "action": "核对负债科目定义、平均/期末口径、期间、单位与合并范围；建立跨期映射。",
          "completion_check": "每个分项都能说明是平均余额还是期末余额，重分类和重述已标出。",
          "stop_if": "关键科目无法对齐或单位不明。"
        },
        {
          "step_id": "step-02",
          "action": "计算整体与分项资金成本：利息支出/平均计息负债；核对报告披露值并解释差异。",
          "completion_check": "百分数按同一时间基础年化，分子分母期间一致，差异不被舍入掩盖。",
          "stop_if": "只有期末余额且负债波动剧烈，无法形成可信平均数。"
        },
        {
          "step_id": "step-03",
          "action": "制作存款质量表：余额、增速、活期/定期、零售/对公、成本与异常变动，并追溯客户或产品原因。",
          "completion_check": "数量增长与成本变化同时解释，未把高增速自动判为优势。",
          "stop_if": null
        },
        {
          "step_id": "step-04",
          "action": "制作批发融资表：同业存放/拆入、回购、同业存单或其他债券的占比、成本、期限、集中度，并尽可能区分主动与结算性资金。",
          "completion_check": "高成本或短久期来源已标记，对应资产用途已追踪。",
          "stop_if": null
        },
        {
          "step_id": "step-05",
          "action": "把负债期限和重定价周期与贷款、投资资产相匹配；读取current-standards选择适用流动性指标，并结合高质量流动资产做方向性压力测试。",
          "completion_check": "至少给出市场资金成本上升、批发资金无法完全续作两个情景下的受影响科目和缓冲。",
          "stop_if": "期限数据完全缺失，只能保留定性警报。"
        },
        {
          "step_id": "step-06",
          "action": "给出负债优势结论：成本、稳定性、错配、流动性缓冲各自评级，并列明当前规则待核验项。",
          "completion_check": "结论能区分‘便宜但脆弱’、‘稳定但昂贵’和‘兼具成本与稳定性’。",
          "stop_if": null
        }
      ],
      "outputs": [
        "负债结构与成本桥",
        "存款质量及批发融资依赖表",
        "期限/重定价错配与流动性压力信号",
        "待核验的监管定义和阈值清单"
      ],
      "stop_conditions": [
        "成本、稳定性、期限错配和缓冲均有证据支持时结束。",
        "缺少平均余额或期限数据时明确降级，不估造精确成本或流动性缺口。",
        "需要合规判定时等待当前权威规则，不沿用原书年份的阈值。"
      ]
    },
    "boundaries": {
      "out_of_scope": [
        "不预测央行具体政策路径或市场利率点位。",
        "不凭公开报表替代银行内部流动性压力测试。",
        "不以单一流动性比率或同业占比直接判定破产风险。"
      ],
      "failure_modes": [
        "把存款增速快等同于低成本、高稳定性。",
        "用期末负债余额计算期间成本且不披露近似。",
        "只看同业负债占比，不看成本、期限和对应资产。",
        "把书中历史监管下限写成永恒常量。"
      ],
      "limitations": [
        "主动与被动同业负债通常无法由主表直接分开，需要成本和附注作间接判断。",
        "公开报告可能缺少足够细的合同到期、重定价和资金集中度数据。",
        "本内部能力卡使用的中国LCR、NSFR、流动性比例、匹配率和优质流动性资产充足率核验截至2026-09-03；以后需重新核验。"
      ],
      "ask_user_when": [
        "只提供某一时点余额但要求精确期间成本。",
        "用户需要在集团口径与母行口径之间选择。"
      ],
      "escalate_when": [
        "出现重大期限缺口、集中融资到期或监管指标临界，但公开资料不足以量化。",
        "用户要求现行合规结论、流动性管理建议或危机处置方案。"
      ]
    }
  },
  "relations": {
    "depends_on": [
      "cap.kan-tou-yin-hang.business-model-map"
    ],
    "contrasts_with": [
      "cap.kan-tou-yin-hang.credit-risk-lifecycle"
    ],
    "composes_with": [
      "cap.kan-tou-yin-hang.net-interest-margin-analysis",
      "cap.kan-tou-yin-hang.capital-growth-analysis",
      "cap.kan-tou-yin-hang.competitive-advantage-trace"
    ],
    "routes_to": [
      "cap.kan-tou-yin-hang.net-interest-margin-analysis"
    ]
  },
  "compilation": {
    "destination": "reference_only",
    "skill_name": null,
    "skill_description": null,
    "skill_license": null,
    "allowed_tools": [],
    "test_suite": "../../test-prompts.json"
  }
}
